Name,Email,LinkedIn,Phone,Location,Focus Area,Check Size (EUR),Angel Network,Portfolio Companies,Personalization Notes,Warm Intro Path,Contact Status,Last Contact Date,Next Action
Chris Neuman,,,,"",Urban tech / Emissions reduction,"25000-100000",The Assembly,"","Founding partner of The Assembly, invests in urban tech for emissions reduction","","Not contacted","",""
Simon Mantkelow,,,,"",Sustainability / Methane detection,"25000-50000",Green Angel Syndicate,"Mindtools (exited), 10+ sustainable startups","Exited Mindtools, invested in 10+ sustainable startups including methane detection and biodiversity monitoring","","Not contacted","",""
James Green (Green Angel Syndicate),james@greenangelsyndicate.com,,,UK,Sustainability / Climate tech,"10000-50000",Green Angel Syndicate,"","Green Angel Syndicate contact, monthly applications","","Not contacted","",""
Taavet Hinrikus,,,,"",AI / Climate overlap,"50000-100000","","Wise (exited), climate tech investments","AI/climate overlap investor, Wise founder","","Not contacted","",""
Eileen Burbidge,,,,"",Fintech / Sustainability,"50000-100000","","Passion Capital portfolio","Fintech/sustainability crossover, Passion Capital","","Not contacted","",""
